{
	"$schema": "./support-patterns.schema.json",
	"version": 1,
	"verified_at": "2026-08-31",
	"review_by": "2026-09-30",
	"setup_runbook": {
		"computer_use_boundary": "Computer Use、認証済みブラウザ、terminal、秘密入力経路はAIホスト側の能力です。開始時に可否を読み、利用不能な面は公式URLと手動経路へ切り替えます。Skill自体はこれらの能力を追加しません。",
		"approval_policy": "事前承認は、対象、payload、変更前後の完全な差分、rollback、plan hash、有効期限を固定した1回限りのgrantを必要数だけ発行します。完全一致する未使用grantは再質問せず1回消費します。変更、期限切れ、使用済みでは停止します。アカウント、ゾーン、ドメインの変更または欠落を観測した時点で、発行済みgrantを台帳から失効させ、明示的な再承認前には再利用しません。DNS変更、外部送信、deploy、migrationを再利用可能な承認へ変えません。",
		"recovery_policy": "タブ消失では、許可済みかつ期待値と完全一致するoriginを実際に開き直してから再読取します。セッション切れ、公式DOM変更、想定外originでは本人性を未確認として発行済みgrantを失効させます。アカウント、ゾーン、ドメインの変更または欠落でも、変更対象をpayloadが含むかに関係なく既存grantをすべて失効させます。3項目がすべて読め、期待値と完全一致し、新しい承認が発行された後にだけ変更操作へ進みます。クリップボード分離時も本人性の確認を先に行い、秘密値を再表示せず、人間の直接入力または秘密入力brokerへ切り替えます。",
		"canary_token_policy": "疎通確認tokenは`canary-`で始まる12〜72文字の小文字英数字とハイフンだけを使います。secret、password、api-key、bearer、tokenを含む値やprovider credential形式は証拠へ取り込みません。",
		"canary_surfaces": [
			"Cloudflare Email RoutingのActivity",
			"WorkerとD1の保存結果",
			"Resendの配信状態",
			"Noroshi UIの受信・送信表示"
		],
		"dns_evidence": "DNSはメールcanaryと分離し、権威DNSと公開DNSリゾルバで同じドメイン、configuration fingerprint、MX、TXTを照合します。",
		"stages": [
			{
				"id": "preflight",
				"title_ja": "事前確認",
				"ai_reads": [
					"Computer Use、認証済みブラウザ、terminal、秘密入力経路の可否と対象アカウント、ゾーン、ドメインを読みます。"
				],
				"human_action": [
					"ログイン、MFA、CAPTCHA、規約、支払い、アカウント切替は利用者が行います。"
				],
				"risk_gate": {
					"required": false,
					"scope": "読み取り専用の事前確認には承認不要です。最初の変更操作へ進む前に、対象、payload、変更前後の完全な差分、rollback、plan hash、有効期限を固定したgrantを必要数だけ確定します。"
				},
				"completion_evidence": [
					"対象の表示名と非秘密ID、既存リソース、料金境界、利用可能な操作面が記録されています。"
				],
				"rollback_to": ["読み取り専用の開始状態へ戻ります。"]
			},
			{
				"id": "resend_authentication",
				"title_ja": "Resend認証",
				"ai_reads": ["送信ドメイン状態とResendが示すDNS要件を読みます。"],
				"human_action": ["アカウント作成、ログイン、秘密値表示、DNS保存は利用者が行います。"],
				"risk_gate": { "required": true, "scope": "送信ドメイン追加と完全一致するDNS変更の前" },
				"completion_evidence": [
					"Resend、権威DNS、公開リゾルバでSPFとDKIMが一致し、送信ドメインが確認済みです。"
				],
				"rollback_to": ["追加した送信用DNSだけを変更前状態へ戻します。"]
			},
			{
				"id": "d1_r2",
				"title_ja": "D1とR2",
				"ai_reads": ["同一Cloudflareアカウント内の既存D1、R2、Worker名とBindingsを読みます。"],
				"human_action": ["リソース作成または既存リソース採用を利用者が承認します。"],
				"risk_gate": {
					"required": true,
					"scope": "D1またはR2の作成、既存リソース採用、Binding変更の前"
				},
				"completion_evidence": [
					"アカウント固有のD1 ID、R2名、Worker Bindingが対象と一致しています。"
				],
				"rollback_to": ["Bindingを変更前へ戻し、新規リソースは削除せず隔離して確認します。"]
			},
			{
				"id": "migration",
				"title_ja": "migration",
				"ai_reads": ["D1が空か既存か、適用済みと未適用のmigration、バックアップ可否を読みます。"],
				"human_action": ["既存D1ではバックアップと適用対象を利用者が確認します。"],
				"risk_gate": { "required": true, "scope": "リモートD1へmigrationを適用する前" },
				"completion_evidence": [
					"空DBは初期化済み、既存DBは未適用migrationだけが順序どおり適用済みです。"
				],
				"rollback_to": ["Workerを直前版へ戻します。追加型migrationを破壊的に巻き戻しません。"]
			},
			{
				"id": "deploy",
				"title_ja": "deploy",
				"ai_reads": ["デプロイ対象revision、Worker名、Bindings、認証主体を読みます。"],
				"human_action": ["Cloudflareへの認証とデプロイ承認は利用者が行います。"],
				"risk_gate": { "required": true, "scope": "対象revisionをWorkerへデプロイする前" },
				"completion_evidence": ["対象revision、Worker名、D1/R2 Binding、稼働URLが一致します。"],
				"rollback_to": ["直前のWorker versionへ戻します。"]
			},
			{
				"id": "secrets",
				"title_ja": "secrets",
				"ai_reads": ["必要なsecret名と登録済み状態だけを読みます。値は読みません。"],
				"human_action": [
					"APIキー、Webhook secret、初回セットアップキーを秘密入力欄へ直接入力します。"
				],
				"risk_gate": { "required": true, "scope": "Worker secretの追加、更新、削除の前" },
				"completion_evidence": [
					"必要なsecret名が登録済みで、秘密値はモデル入出力、ファイル、ログに0件です。"
				],
				"rollback_to": ["追加したsecretを個別に無効化または削除します。秘密値は復元しません。"]
			},
			{
				"id": "email_routing",
				"title_ja": "Email Routing",
				"ai_reads": [
					"Worker名、Routing Ruleの転送先、関連Service Binding、MX/TXTの現在値を読みます。"
				],
				"human_action": ["Routing Rule、MX/TXTの変更を利用者が承認して保存します。"],
				"risk_gate": { "required": true, "scope": "Email Routing有効化、転送先変更、DNS変更の前" },
				"completion_evidence": [
					"Worker名、転送先、Service Bindingが一致します。DNSは権威DNSと公開リゾルバで同じドメイン、configuration fingerprint、MX、TXTが一致します。"
				],
				"rollback_to": ["Routing Ruleを無効化し、保存した旧MX/TXTへ戻します。"]
			},
			{
				"id": "first_admin",
				"title_ja": "初回管理者",
				"ai_reads": [
					"初回セットアップ画面、管理者作成後の非秘密状態、セットアップキー無効化状態を読みます。"
				],
				"human_action": ["初回管理者情報とセットアップキーを利用者が直接入力し、ログインします。"],
				"risk_gate": { "required": true, "scope": "初回管理者を作成する前" },
				"completion_evidence": ["管理者がログインでき、同じセットアップキーが再利用不可です。"],
				"rollback_to": ["管理者を自動削除せず、Worker secretを無効化して手動確認へ戻ります。"]
			},
			{
				"id": "outbound_send",
				"title_ja": "送信",
				"ai_reads": [
					"送信元、宛先、件名、非秘密canary、idempotency key、Resend送信状態を読みます。"
				],
				"human_action": ["制御済み外部メール1通の送信を利用者が承認します。"],
				"risk_gate": { "required": true, "scope": "宛先と内容が固定された外部メールを1通送る前" },
				"completion_evidence": [
					"Noroshi、D1、Resendで同じcanaryとidempotency keyが1件だけ記録されています。"
				],
				"rollback_to": ["不確実な送信結果を再送せず、providerとD1のreadbackへ戻ります。"]
			},
			{
				"id": "reply_receive",
				"title_ja": "返信受信",
				"ai_reads": ["Cloudflare Activity、Worker、D1、Noroshi UIの同じcanaryを読みます。"],
				"human_action": ["テスターが受信した制御済みメールへ返信します。"],
				"risk_gate": { "required": true, "scope": "返信元、返信先、canaryが固定された1通の返信前" },
				"completion_evidence": [
					"Cloudflare Email Routing Activity、Worker/D1、Resend、Noroshi UIで返信canaryが1件だけ一致します。"
				],
				"rollback_to": ["Routingを変更せず、Cloudflare ActivityとWorker/D1の失敗点へ戻ります。"]
			},
			{
				"id": "rollback",
				"title_ja": "rollback",
				"ai_reads": [
					"変更前スナップショット、現在のRouting/DNS/Worker状態、所有リソースを読みます。"
				],
				"human_action": ["対象と変更差分が固定された復旧操作を利用者が承認します。"],
				"risk_gate": {
					"required": true,
					"scope": "Routing、DNS、deploy、secretを変更前状態へ戻す前"
				},
				"completion_evidence": [
					"メール証拠はCloudflare Email Routing Activity、Worker/D1、Resend、Noroshi UIで一致します。DNS証拠は権威DNSと公開リゾルバで同じドメイン、configuration fingerprint、MX、TXTが一致し、2回目の復旧操作はno-opです。"
				],
				"rollback_to": ["復旧結果が不一致なら追加変更せず、最後に確認できた状態へ停止します。"]
			}
		],
		"deferred": ["MBOX", "IMAP", "自動返信", "List-Unsubscribe"],
		"not_adopted": [
			"共有受信箱",
			"WebSocket",
			"カレンダー",
			"自己更新",
			"Cloudflare Email Serviceによる外部送信"
		]
	},
	"patterns": [
		{
			"id": "deploy.banner.boundary",
			"title_ja": "Cloudflareへ配置できたがメールが使えない",
			"category": "deployment",
			"stage": "Cloudflareへのデプロイ直後",
			"applicability": [
				"公開されたNoroshiリポジトリからDeployボタンを使った場合",
				"Workerのビルド自体は完了している場合"
			],
			"diagnostic_questions": [
				"Worker、D1、R2が同じCloudflareアカウントに作成されていますか。",
				"Email Routing、Resend、初回管理者の設定は別に完了していますか。",
				"デプロイに使うWrangler認証とWorker実行時のAPI Tokenを別用途として管理していますか。"
			],
			"safe_steps": [
				"デプロイ完了とメール開通を分けて確認します。",
				"作成されたWorker、D1、R2の名前とBindingsだけを読み取ります。",
				"未完了の設定を受信、送信、初回管理者の順に一覧化します。"
			],
			"human_only": ["Cloudflareへのログイン、利用規約、MFA、課金判断は利用者が行います。"],
			"prohibited": [
				"デプロイ成功だけを根拠に受信・送信可能と案内しません。",
				"公開URLが未設定のリポジトリを別製品へ向けません。",
				"Wranglerのデプロイ認証をWorker runtime secretとして再利用しません。"
			],
			"risk_gate": {
				"class": "deployment",
				"trigger": "再デプロイ、リソース作成、シークレット登録を行う前",
				"approval_required": true
			},
			"rollback": [
				"新しい変更を加えず、現行デプロイと作成済みリソースを保持して不足設定を確認します。"
			],
			"expected_evidence": [
				"Workerのデプロイ状態、D1とR2のBinding、未完了設定の一覧が確認できます。"
			],
			"unsupported": [
				"DeployボタンだけでDNS、Email Routing、Resend、初回管理者まで自動設定する保証はありません。"
			],
			"source_refs": [
				"cloudflare-deploy-buttons",
				"cloudflare-wrangler-auth",
				"cloudflare-worker-secrets",
				"quickmail-upstream",
				"agentmail"
			],
			"verified_at": "2026-08-27",
			"review_by": "2026-09-26",
			"confidence": "high"
		},
		{
			"id": "cloudflare.account.preflight",
			"title_ja": "Cloudflareの対象アカウントとドメインを確認する",
			"category": "cloudflare",
			"stage": "外部設定を変更する前",
			"applicability": [
				"複数のCloudflareアカウントまたは複数ドメインを管理している場合",
				"セットアップ支援を開始する場合"
			],
			"diagnostic_questions": [
				"対象ドメインの権威DNSはどのCloudflareアカウントにありますか。",
				"同名のWorker、D1、R2がすでに存在しますか。"
			],
			"safe_steps": [
				"アカウント、ゾーン、既存リソースを読み取り専用で列挙します。",
				"対象をIDと表示名の両方で利用者に示します。",
				"同名リソースは自動採用せず衝突として止めます。"
			],
			"human_only": ["対象アカウントの選択と権限付与は利用者が確認します。"],
			"prohibited": ["一覧の先頭を自動選択しません。", "読み取り失敗を未作成と扱いません。"],
			"risk_gate": {
				"class": "account-selection",
				"trigger": "アカウント、ゾーン、既存リソースを確定する前",
				"approval_required": true
			},
			"rollback": ["読み取りだけで停止し、選択状態を破棄します。"],
			"expected_evidence": ["選択したアカウントとゾーン、同名リソースの有無が明示されます。"],
			"unsupported": ["対象が一意でない状態での自動セットアップは対応しません。"],
			"source_refs": [
				"cloudflare-deploy-buttons",
				"cloudflare-route-emails",
				"cloudflare-wrangler-auth",
				"agentmail"
			],
			"verified_at": "2026-08-27",
			"review_by": "2026-09-26",
			"confidence": "high"
		},
		{
			"id": "cloudflare.email.routing",
			"title_ja": "Cloudflare Email Routingで受信ドメインを有効にする",
			"category": "cloudflare",
			"stage": "受信設定",
			"applicability": [
				"対象ドメインのDNSをCloudflareで管理している場合",
				"Noroshiへ受信メールを保存する場合"
			],
			"diagnostic_questions": [
				"Email Routingのドメイン状態は有効ですか。",
				"Cloudflareが示すMX、SPF、DKIMの状態は確認済みですか。"
			],
			"safe_steps": [
				"変更前のDNSレコードとRouting Rulesを保存します。",
				"Cloudflare公式画面が示す受信用レコードとの差分を作ります。",
				"反映後は権威DNSと画面の両方で状態を確認します。"
			],
			"human_only": ["MX切替と既存メールサービス停止の判断は利用者が行います。"],
			"prohibited": [
				"Cloudflare DNSを使っていないドメインへEmail Routingを設定しません。",
				"既存MXを推測値で置き換えません。"
			],
			"risk_gate": {
				"class": "dns-email-routing",
				"trigger": "Email Routing有効化またはDNSレコード変更の前",
				"approval_required": true
			},
			"rollback": [
				"保存した変更前のMX、SPF、DKIMとRouting Rulesへ戻します。",
				"D1、R2、Workerは原因確認が終わるまで削除しません。"
			],
			"expected_evidence": ["Email Routingのドメイン状態と受信用レコードが一致します。"],
			"unsupported": ["Cloudflare以外が権威DNSのままではこの受信構成を利用できません。"],
			"source_refs": [
				"cloudflare-route-emails",
				"cloudflare-email-domain-configuration",
				"cloudflare-agentic-inbox",